{
  "schemaVersion": 1,
  "appVersion": "0.1.0-alpha.5",
  "exportedAt": "2026-04-27T11:30:00.000Z",
  "data": {
    "pages": [
      {
        "slug": "about",
        "title": "About — Updated",
        "content": "# About\n\nUpdated by overlap fixture.",
        "createdAt": "2025-11-02 03:11:13",
        "updatedAt": "2026-04-27 11:30:00"
      },
      {
        "slug": "home",
        "title": "Home — Updated",
        "content": "# Welcome\n\nUpdated by overlap fixture.",
        "createdAt": "2026-02-14 09:47:48",
        "updatedAt": "2026-04-27 11:30:00"
      }
    ],
    "siteSettings": [
      {
        "key": "footer",
        "value": "Footer overwritten by overlap fixture.",
        "createdAt": "2026-04-27 10:46:01",
        "updatedAt": "2026-04-27 11:30:00"
      }
    ],
    "categories": [
      {
        "id": "3f710286-e2bd-45a1-962b-510828192863",
        "slug": "books",
        "name": "Books — Updated",
        "description": "Overlap fixture — same UUID, different content.",
        "order": 0,
        "cutoffS": 90,
        "cutoffA": 80,
        "cutoffB": 70,
        "cutoffC": 60,
        "cutoffD": 50,
        "cutoffE": 40,
        "cutoffF": 0,
        "propKeys": [
          { "key": "ISBN" },
          { "key": "Language" }
        ],
        "createdAt": "2026-04-27 10:35:42",
        "updatedAt": "2026-04-27 11:30:00",
        "items": [
          {
            "id": "cfabdd74-64a7-49c6-80d2-c09a2981d231",
            "slug": "influence-the-psychology-of-persuasion",
            "name": "Influence — Updated",
            "description": "Overlap fixture — same UUID, different content.",
            "score": 88,
            "order": 0,
            "imageHash": null,
            "placeholder": null,
            "props": [
              { "key": "ISBN", "value": "978-0-06-124189-5" },
              { "key": "Author(s)", "value": "Robert B. Cialdini" }
            ],
            "createdAt": "2026-04-27 10:41:02",
            "updatedAt": "2026-04-27 11:30:00"
          }
        ]
      },
      {
        "id": "aa1ceecc-9d73-4d89-9eb9-515cc509ccb3",
        "slug": "board-games",
        "name": "Board Games — Updated",
        "description": "Overlap fixture — same UUID, different content.",
        "order": 1,
        "cutoffS": 85,
        "cutoffA": 70,
        "cutoffB": 65,
        "cutoffC": 50,
        "cutoffD": 35,
        "cutoffE": 10,
        "cutoffF": 0,
        "propKeys": [],
        "createdAt": "2026-04-27 10:37:05",
        "updatedAt": "2026-04-27 11:30:00",
        "items": [
          {
            "id": "d931493b-ae7a-4bb3-a67c-2f00e73d90f1",
            "slug": "chess",
            "name": "Chess — Updated",
            "description": "Overlap fixture — score bumped.",
            "score": 99,
            "order": 0,
            "imageHash": null,
            "placeholder": null,
            "props": [],
            "createdAt": "2026-04-27 10:45:05",
            "updatedAt": "2026-04-27 11:30:00"
          },
          {
            "id": "3d274e8b-b03b-4fd3-ae1f-e0161511032b",
            "slug": "risk",
            "name": "Risk — Updated",
            "description": "Overlap fixture — same UUID, different content.",
            "score": 60,
            "order": 1,
            "imageHash": null,
            "placeholder": null,
            "props": [],
            "createdAt": "2026-04-27 10:44:10",
            "updatedAt": "2026-04-27 11:30:00"
          },
          {
            "id": "5305d366-fb18-49c2-b6e0-2184b1b21074",
            "slug": "monopoly",
            "name": "Monopoly — Updated",
            "description": "Overlap fixture — same UUID, different content.",
            "score": 20,
            "order": 2,
            "imageHash": null,
            "placeholder": null,
            "props": [],
            "createdAt": "2026-04-27 10:43:50",
            "updatedAt": "2026-04-27 11:30:00"
          }
        ]
      }
    ]
  }
}
